job_id,title,location,department,salary_range,company_profile,description,requirements,benefits,telecommuting,has_company_logo,has_questions,employment_type,required_experience,required_education,industry,function,fraudulent,y_true,y_pred,combined_text,text_char_len,text_word_len,title_missing,company_profile_missing,description_missing,requirements_missing,benefits_missing,missing_text_fields,missing_cat_fields,is_error,error_type
6691,Market Operations Manager ,"US, TX, AUSTIN",HEADQUATERS,65000-85000,"The Accion  story began more than 100 years ago in the Austin,Tx with one family owned establishment. Today, Accion  has grown into a nationwide Organazation with over 260 stores. Accion success is attributed to our unique niche in the market offering current   finance option at competitive prices paired with customer service and a personal shopping experience. Join the Accion story today!","ExemptSHIFT WORKEDMonday-Sundays, Days, NightsSALARY$65,000 starting salary; ramping up as stores open in market.  Bi-annual performance bonus opportunity.  POSITION OVERVIEWManages the overall operation of their home store and exercises discretion while doing so.  Ensures company standards are met and ensures store Associates comply with policies and procedures.  Develops and ensures compliance with Corporate Store policies and procedures.  Upholds and executes the vision and mission of Yogurtland.  Assists the ROM by overseeing and helping Store Managers resolve operational issues for two or more stores in their area.  CULTURAL QUALIFICATIONSHumble – We are modest, respectful, open and never arrogant, despite our successes.  We grow by giving and accepting honest feedback, even when it is personally challenging.Teamwork – We work collaboratively by capitalizing on the strengths of every member of our team and collectively own both our successes and our shortcomings.Passionate – We love what we do, reach for the best, and strive to positively impact the lives of our guests, colleagues, franchisees, and vendors.Innovative – With an open mind and fresh ideas with are continuously evolving and creating new possibilities in our products, the way we do business, and our interactions with others.THTK: Totally Honest – Totally Kind - We work and live with great integrity, accountability, and compassion.  KEY METRICSSuccessful opening of new stores.Same Store Sales Increase.Food Cost.Labor Cost.Net Profit.  ESSENTIAL JOB FUNCTIONSCash Handling (bank deposits, safe deposits, etc.) is accountable for all funds.Scheduling of Associates effectively and efficiently.Controls store operational cost (food, labor, etc.).Maintain adequate inventory levels.Ensures all Associates adhere to all company standards, policies and procedures.Coordinates and communicates assignments throughout shift.Coordinates training, coaching and development of newly hired Associates.Ensures all Associates adhere to meal and break periods.Taste product to ensure quality standards are met.Is the “role-model” for outstanding customer service and Associate standards.Ensures cleanliness, health, security and safety standards are maintained at all times.Maintains building, machines and store operating equipment and schedules preventive maintenance.Conducts Associate meetings as needed.Maintains and creates reports and records based company standards and in compliance of local, state and federal regulations.Maintains a cooperative and interactive relationship with the YLSC.Provides counseling, coaching, discipline and mentoring to Associates as warranted.Other job-related activities as requested.Assists/teaches assigned Store Managers with the above. CORE COMPETENCIESAbility to exercise mature judgment and reasoning.Ability to problem solve quickly and effectively.Effective customer service skills delivered with a friendly disposition.Ability to communicate clearly and concisely.Ability to actively listen and address Associates’ concerns, comments and/or issues.Ability to lead others in always upholding company standards.Knowledge of staffing, scheduling and inventory processes.Internally motivated and ability to motivate others.Ability to act independently and effectively.Knowledge of organizational and planning skills.Knowledge of team-building, leadership, coaching and mentoring skills.                                                              ",OTHER REQUIREMENTS (LICENSES/CERTIFICATIONS)Previous management experience.4-year college degree or 8 years hospitality experience.Proficient with MS Office Word and Excel programs. afe or equivalent certification.,ALL BENEFITS,0,1,1,Full-time,Mid-Senior level,Some College Coursework Completed,Management Consulting,Finance,1,1,0,"Market Operations Manager The Accion story began more than 100 years ago in the Austin,Tx with one family owned establishment. Today, Accion has grown into a nationwide Organazation with over 260 stores. Accion success is attributed to our unique niche in the market offering current finance option at competitive prices paired with customer service and a personal shopping experience. Join the Accion story today! ExemptSHIFT WORKEDMonday-Sundays, Days, NightsSALARY$65,000 starting salary; ramping up as stores open in market. Bi-annual performance bonus opportunity. POSITION OVERVIEWManages the overall operation of their home store and exercises discretion while doing so. Ensures company standards are met and ensures store Associates comply with policies and procedures. Develops and ensures compliance with Corporate Store policies and procedures. Upholds and executes the vision and mission of Yogurtland. Assists the ROM by overseeing and helping Store Managers resolve operational issues for two or more stores in their area. CULTURAL QUALIFICATIONSHumble – We are modest, respectful, open and never arrogant, despite our successes. We grow by giving and accepting honest feedback, even when it is personally challenging.Teamwork – We work collaboratively by capitalizing on the strengths of every member of our team and collectively own both our successes and our shortcomings.Passionate – We love what we do, reach for the best, and strive to positively impact the lives of our guests, colleagues, franchisees, and vendors.Innovative – With an open mind and fresh ideas with are continuously evolving and creating new possibilities in our products, the way we do business, and our interactions with others.THTK: Totally Honest – Totally Kind - We work and live with great integrity, accountability, and compassion. KEY METRICSSuccessful opening of new stores.Same Store Sales Increase.Food Cost.Labor Cost.Net Profit. ESSENTIAL JOB FUNCTIONSCash Handling (bank deposits, safe deposits, etc.) is accountable for all funds.Scheduling of Associates effectively and efficiently.Controls store operational cost (food, labor, etc.).Maintain adequate inventory levels.Ensures all Associates adhere to all company standards, policies and procedures.Coordinates and communicates assignments throughout shift.Coordinates training, coaching and development of newly hired Associates.Ensures all Associates adhere to meal and break periods.Taste product to ensure quality standards are met.Is the “role-model” for outstanding customer service and Associate standards.Ensures cleanliness, health, security and safety standards are maintained at all times.Maintains building, machines and store operating equipment and schedules preventive maintenance.Conducts Associate meetings as needed.Maintains and creates reports and records based company standards and in compliance of local, state and federal regulations.Maintains a cooperative and interactive relationship with the YLSC.Provides counseling, coaching, discipline and mentoring to Associates as warranted.Other job-related activities as requested.Assists/teaches assigned Store Managers with the above. CORE COMPETENCIESAbility to exercise mature judgment and reasoning.Ability to problem solve quickly and effectively.Effective customer service skills delivered with a friendly disposition.Ability to communicate clearly and concisely.Ability to actively listen and address Associates’ concerns, comments and/or issues.Ability to lead others in always upholding company standards.Knowledge of staffing, scheduling and inventory processes.Internally motivated and ability to motivate others.Ability to act independently and effectively.Knowledge of organizational and planning skills.Knowledge of team-building, leadership, coaching and mentoring skills. OTHER REQUIREMENTS (LICENSES/CERTIFICATIONS)Previous management experience.4-year college degree or 8 years hospitality experience.Proficient with MS Office Word and Excel programs. afe or equivalent certification. ALL BENEFITS",4040,525,False,False,False,False,False,0,0,1,FN
17818,CSR,"US, LA, Slidell",,,,Now hiring CSR / Advertising representatives to work from homeMust Have:Customer Service RepresentativeComputerInternetPhoneFor more information call (985) 250-0381Interview Immediately ,,,0,0,0,Part-time,Entry level,Unknown,Online Media,Unknown,1,1,0,CSR Now hiring CSR / Advertising representatives to work from homeMust Have:Customer Service RepresentativeComputerInternetPhoneFor more information call (985) 250-0381Interview Immediately,189,20,False,True,False,True,True,3,2,1,FN
17555,Entry Level Medical Transcriptionist,"US, CA, Los Angeles",,0-0,,"We need a Medical Transcriptionist who will transcribe reports recorded by physicians and other healthcare practitioners. The types of documents include items such as, letters, chart notes and reports. You will work from home via a virtual project management site. You will be transcribing audio recordings into printed reports. These recordings, dictated by physicians or other healthcare professionals, become part of permanent written records by way of your transcription services. Additional responsibilities of the role include: Transcribing dictation for a variety of reports, including:Patient historiesPhysical examinationsEmergency room visitsOperationsChart reviewsConsultationsDischarge summariesTranslating medical jargon and abbreviations into their expanded formsEnsuring the accuracy of patient and health care facility recordsEditing as necessary and returning reports in electronic form for reviewCompleting work on time, within a 24 hour time frame","Transcribing dictation for a variety of reports, including:Patient historiesPhysical examinationsEmergency room visitsOperationsChart reviewsConsultationsDischarge summariesTranslating medical jargon and abbreviations into their expanded formsEnsuring the accuracy of patient and health care facility recordsEditing as necessary and returning reports in electronic form for reviewCompleting work on time, within a 24 hour time frame",Other benefits of the Transcriber position include: Work at home and at your own paceYou make your own scheduleAbility to work day or night depending on your preferenceHigh demand in several industries for transcribersAbility to spend more time with your familyAvoid expenses such as daycareSave money on gas and business office attireLess wear and tear on your vehicle lowers your auto insuranceFlexibility and freedom to manage yourself!,1,0,0,Full-time,Entry level,High School or equivalent,Medical Practice,Unknown,1,1,0,"Entry Level Medical Transcriptionist We need a Medical Transcriptionist who will transcribe reports recorded by physicians and other healthcare practitioners. The types of documents include items such as, letters, chart notes and reports. You will work from home via a virtual project management site. You will be transcribing audio recordings into printed reports. These recordings, dictated by physicians or other healthcare professionals, become part of permanent written records by way of your transcription services. Additional responsibilities of the role include: Transcribing dictation for a variety of reports, including:Patient historiesPhysical examinationsEmergency room visitsOperationsChart reviewsConsultationsDischarge summariesTranslating medical jargon and abbreviations into their expanded formsEnsuring the accuracy of patient and health care facility recordsEditing as necessary and returning reports in electronic form for reviewCompleting work on time, within a 24 hour time frame Transcribing dictation for a variety of reports, including:Patient historiesPhysical examinationsEmergency room visitsOperationsChart reviewsConsultationsDischarge summariesTranslating medical jargon and abbreviations into their expanded formsEnsuring the accuracy of patient and health care facility recordsEditing as necessary and returning reports in electronic form for reviewCompleting work on time, within a 24 hour time frame Other benefits of the Transcriber position include: Work at home and at your own paceYou make your own scheduleAbility to work day or night depending on your preferenceHigh demand in several industries for transcribersAbility to spend more time with your familyAvoid expenses such as daycareSave money on gas and business office attireLess wear and tear on your vehicle lowers your auto insuranceFlexibility and freedom to manage yourself!",1876,247,False,True,False,False,False,1,1,1,FN
17730,Intern Development Assistant,"US, CA, Los Angeles",Programming,,,We Are Looking for college interns with the passion to be in the entertainment industry. Industry Mogul Alander Pulliam has put together a youth and motivated program for college students throughout the Los Angeles market. To help college students enrich there knowledge and there experience.,"You will be working alongside of the Producers and writers, helping and developing shows to put onto the programming for the network, you are required to have a high school diploma, preferabbly a Bachelors Degree, at least one year of experience.",,0,1,1,Other,Internship,High School or equivalent,Entertainment,Business Development,1,1,0,"Intern Development Assistant We Are Looking for college interns with the passion to be in the entertainment industry. Industry Mogul Alander Pulliam has put together a youth and motivated program for college students throughout the Los Angeles market. To help college students enrich there knowledge and there experience. You will be working alongside of the Producers and writers, helping and developing shows to put onto the programming for the network, you are required to have a high school diploma, preferabbly a Bachelors Degree, at least one year of experience.",568,89,False,True,False,False,True,2,0,1,FN
4669,Human Resource Director,"US, TX, AUSTIN",HR,50000-65000,"As the industry’s largest supply contracting company, Novation serves the purchasing needs of more than 65,000 VHA, UHC and Provista member organizations and their affilliates. Novation delivers unmatched supply savings and value through its sourcing services, as well as information and data services. Through its affiliation with VHA, UHC and Provista, Novation represents the largest purchasing volume in the industry more than $40 billion in annual purchases.To help our alliance members meet the needs of their communities, our mission is to deliver to them unmatched savings and value. One of the ways we deliver on our mission is by facilitating the introduction of products and services that are designed to help members drive sustainable results, improve quality and reduce costs.","HR responsibilities for assigned client groups in the traditional ares of human resources (ie., employee relations, HRIS, LMS, training, employee development, performance management, etc.) Develops and builds strong relationships with company leadership, management and employees and work at a both tactical and strategic level to develop, implement and manage human resources policies &amp; procedures at work. RESPONSIBILITIES1.     Manages individual employee relations cases and investigations as needed, from incident reporting through final disposition. Ensures that all cases are properly documented and responsible for issuing complete  reports and recommendations to senior management2.     Acts as Human Resources Business Partner and primary HR contact for business unit3.     Primary point of contact for HR-related Alertline issues4.     Develops, implements, and reviews on an ongoing basis HR systems/processes/policies; makes recommendations for improvements to  HR systems/processes/policies.5.     Provide HR input into cross-functional Company initiatives and process/policy development, implementation, and application6.     Consults with managers on performance management, including annual reviews, warnings, and performance improvement #URL_b23ad1cf3ed66a68b1c25a6e73a6fab7a2e63abc108bb9a8cddf1430a715ebe3# with management regarding termination decisions and ensures that all proper corrective action procedures are implemented where appropriate7.     Ensures consistency in the application and enforcement of policies and procedures and compliance with applicable employment laws and regulations.8.     Leads and supports HR Department projects and initiatives. 9.     Provides relevant HR training to managers and employees10.   Presents material as part of the New Hire Orientation. Also serves as a facilitator for New Leader On-Boarding11.   Supervises HRIS and LMS functions and provides strategic guidance regarding HR systems implementation and maintenance."," Minimum of 6 Months corporate Human Resources experience2.     Previous experience in the Pharmaceutical,Dental  or Medical Device Industry is strongly preferred.3.     In-depth experience with HR systems (HRIS, ATS, and LMS) strongly preferred. 4.     Must possess a strong ability to cultivate a “team” atmosphere throughout the organization; minimum of 3 years of experience effectively managing and developing direct reports5.     Experience with all varieties of HR issues with both a strategic and a tactical, hands-on approach6.     Able to effectively work with colleagues and provide expertise with HR issues at all levels  of the organization7.     Able to operate independently, understanding when to escalate issues8.     Must possess excellent verbal, written and oral communication skills. 9.  Strong cross-functional interaction and collaboration with internal partners, e.g. Finance, IT, and Compliance, etc.",ALL BENEFITS,0,1,1,Full-time,Director,High School or equivalent,Human Resources,Human Resources,1,1,0,"Human Resource Director As the industry’s largest supply contracting company, Novation serves the purchasing needs of more than 65,000 VHA, UHC and Provista member organizations and their affilliates. Novation delivers unmatched supply savings and value through its sourcing services, as well as information and data services. Through its affiliation with VHA, UHC and Provista, Novation represents the largest purchasing volume in the industry more than $40 billion in annual purchases.To help our alliance members meet the needs of their communities, our mission is to deliver to them unmatched savings and value. One of the ways we deliver on our mission is by facilitating the introduction of products and services that are designed to help members drive sustainable results, improve quality and reduce costs. HR responsibilities for assigned client groups in the traditional ares of human resources (ie., employee relations, HRIS, LMS, training, employee development, performance management, etc.) Develops and builds strong relationships with company leadership, management and employees and work at a both tactical and strategic level to develop, implement and manage human resources policies &amp; procedures at work. RESPONSIBILITIES1. Manages individual employee relations cases and investigations as needed, from incident reporting through final disposition. Ensures that all cases are properly documented and responsible for issuing complete reports and recommendations to senior management2. Acts as Human Resources Business Partner and primary HR contact for business unit3. Primary point of contact for HR-related Alertline issues4. Develops, implements, and reviews on an ongoing basis HR systems/processes/policies; makes recommendations for improvements to HR systems/processes/policies.5. Provide HR input into cross-functional Company initiatives and process/policy development, implementation, and application6. Consults with managers on performance management, including annual reviews, warnings, and performance improvement #URL_b23ad1cf3ed66a68b1c25a6e73a6fab7a2e63abc108bb9a8cddf1430a715ebe3# with management regarding termination decisions and ensures that all proper corrective action procedures are implemented where appropriate7. Ensures consistency in the application and enforcement of policies and procedures and compliance with applicable employment laws and regulations.8. Leads and supports HR Department projects and initiatives. 9. Provides relevant HR training to managers and employees10. Presents material as part of the New Hire Orientation. Also serves as a facilitator for New Leader On-Boarding11. Supervises HRIS and LMS functions and provides strategic guidance regarding HR systems implementation and maintenance. Minimum of 6 Months corporate Human Resources experience2. Previous experience in the Pharmaceutical,Dental or Medical Device Industry is strongly preferred.3. In-depth experience with HR systems (HRIS, ATS, and LMS) strongly preferred. 4. Must possess a strong ability to cultivate a “team” atmosphere throughout the organization; minimum of 3 years of experience effectively managing and developing direct reports5. Experience with all varieties of HR issues with both a strategic and a tactical, hands-on approach6. Able to effectively work with colleagues and provide expertise with HR issues at all levels of the organization7. Able to operate independently, understanding when to escalate issues8. Must possess excellent verbal, written and oral communication skills. 9. Strong cross-functional interaction and collaboration with internal partners, e.g. Finance, IT, and Compliance, etc. ALL BENEFITS",3667,490,False,False,False,False,False,0,0,1,FN
