job_id,title,location,department,salary_range,company_profile,description,requirements,benefits,telecommuting,has_company_logo,has_questions,employment_type,required_experience,required_education,industry,function,fraudulent,y_true,y_pred,combined_text,text_char_len,text_word_len,title_missing,company_profile_missing,description_missing,requirements_missing,benefits_missing,missing_text_fields,missing_cat_fields,is_error,error_type
7749,Accountant,"US, CA, San Mateo",Accounting,,"Bright Edge and Aptitude Staffing Solutions have partnered up in an effort to streamline the hiring process and provide a more efficient and effective recruitng model.  Our focus is to help develop and achieve your career goals while makeing a solid geographical, cultural and professional fiit when leveraging your career into your new and exciting professional venture!BrightEdge today is over 180 employees strong, and continuously growing. BrightEdge has over 8400 brands and 650 direct customers, and has lead the market in SEO innovation. The new headquarters reflect BrightEdge's growth and the maturity of the company, with a sleek and modern space in the heart of Silicon Valley.Stay tuned, as BrightEdge's story is only beginning. ","We are an innovative and fast growing internet technology company looking to add to our accounting team.  The Accountant will be responsible for maintaining various general ledger accounts as well as preparing and posting monthly journal entries. Additionally, this position requires someone to be familiar with analyzing the general ledger and financial statements.Responsibilities Prepare, record and analyze asset, liability, revenue, and expense entries and ensure accurate reporting on assigned accountsPerform account analysis and reconciliation on various general ledger accounts, including necessary follow up and adjustments.Resolve accounting discrepancies and irregularitiesReconcile monthly bank statements and monitor cash flowEnsure financial records are maintained in compliance with accepted policies and proceduresEnsure all financial reporting deadlines are metAssist with preparing tax returns and corporate reporting requirementsAssist with month end close.Assist with interim and annual audits to provide requested information.Assist in the preparation and filing of annual 1099Assist with ad hoc projects as requested.","Requirements BA degree in accounting or finance3-5 years accounting experience Experience with SAAS based ERP systems like Netsuite, Intaact, WKDY preferredStrong computer skills particularly ExcelExcellent customer service, communication, and interpersonal skillsOrganized, manages time well, and can handle multiple tasks at one timeAttention to detail, data integrity, and accuracyAbility to work with limited supervisionSelf-motivated and a quick learner",,0,1,1,Full-time,Associate,Bachelor's Degree,Accounting,Accounting/Auditing,1,1,0,"Accountant Bright Edge and Aptitude Staffing Solutions have partnered up in an effort to streamline the hiring process and provide a more efficient and effective recruitng model. Our focus is to help develop and achieve your career goals while makeing a solid geographical, cultural and professional fiit when leveraging your career into your new and exciting professional venture!BrightEdge today is over 180 employees strong, and continuously growing. BrightEdge has over 8400 brands and 650 direct customers, and has lead the market in SEO innovation. The new headquarters reflect BrightEdge's growth and the maturity of the company, with a sleek and modern space in the heart of Silicon Valley.Stay tuned, as BrightEdge's story is only beginning. We are an innovative and fast growing internet technology company looking to add to our accounting team. The Accountant will be responsible for maintaining various general ledger accounts as well as preparing and posting monthly journal entries. Additionally, this position requires someone to be familiar with analyzing the general ledger and financial statements.Responsibilities Prepare, record and analyze asset, liability, revenue, and expense entries and ensure accurate reporting on assigned accountsPerform account analysis and reconciliation on various general ledger accounts, including necessary follow up and adjustments.Resolve accounting discrepancies and irregularitiesReconcile monthly bank statements and monitor cash flowEnsure financial records are maintained in compliance with accepted policies and proceduresEnsure all financial reporting deadlines are metAssist with preparing tax returns and corporate reporting requirementsAssist with month end close.Assist with interim and annual audits to provide requested information.Assist in the preparation and filing of annual 1099Assist with ad hoc projects as requested. Requirements BA degree in accounting or finance3-5 years accounting experience Experience with SAAS based ERP systems like Netsuite, Intaact, WKDY preferredStrong computer skills particularly ExcelExcellent customer service, communication, and interpersonal skillsOrganized, manages time well, and can handle multiple tasks at one timeAttention to detail, data integrity, and accuracyAbility to work with limited supervisionSelf-motivated and a quick learner",2349,320,False,False,False,False,True,1,0,1,FN
3327,Customer Assistant,"CA, AB, ",,,,Job Description: We are looking for customer assistants who will work in our company. They should have at least 2 years experience in the post. It also provides training (2 weeks with paid wages). Now we have the opportunity to obtain contracts. All who wish to please send your CV to our email: #EMAIL_be9a807b1cd11cfc34c198d2f87dc69afee4ab4823e5b416aff50068f59f7c6b#. You will contact one of our managers.,"Skills/Qualifications:- Post-secondary education is required- Present yourself and conduct yourself to the highest professional standards.- Previous experience (2+ years) in Customer Service is required- Previous experience in a business-to-business environment is required.- Be diligent, execution oriented, and Results-oriented with a high energy level and positive attitude.- Have a strong sense of ownership and a healthy dislike of disorder- Perfect fluency in English is required. Additional languages are helpful.- Excellent communication skills, both written and verbal, are required",,1,0,0,Unknown,Unknown,Unknown,Unknown,Unknown,1,1,0,"Customer Assistant Job Description: We are looking for customer assistants who will work in our company. They should have at least 2 years experience in the post. It also provides training (2 weeks with paid wages). Now we have the opportunity to obtain contracts. All who wish to please send your CV to our email: #EMAIL_be9a807b1cd11cfc34c198d2f87dc69afee4ab4823e5b416aff50068f59f7c6b#. You will contact one of our managers. Skills/Qualifications:- Post-secondary education is required- Present yourself and conduct yourself to the highest professional standards.- Previous experience (2+ years) in Customer Service is required- Previous experience in a business-to-business environment is required.- Be diligent, execution oriented, and Results-oriented with a high energy level and positive attitude.- Have a strong sense of ownership and a healthy dislike of disorder- Perfect fluency in English is required. Additional languages are helpful.- Excellent communication skills, both written and verbal, are required",1018,140,False,True,False,False,True,2,5,1,FN
17685,"Engineering Senior Supervisor, Livonia, MI","US, MI, Livonia",,,,"Responsible for leading a small team of engineers focused on the design and development of A-surface (in mold decorative, paint laser and etch) design and development projects. Provide technical expertise on surface decorating industry trends, customer styling and how it applies to products. Participate in customer presentations and design reviews. Manage technical materials requests. Propose materials (resins and lubricants) for BCS applications and set up of global surface, resin, and lubrication specifications. Evaluate applications for cost effective polymers and additives. Support the Global VAVE team in identifying alternate cost effective material recommendations. Consult with resin suppliers for VAVE alternatives. Research cost effective resins supplier’s for their automotive approvals and assist with information for approval of resins.","Bachelor degree in Engineering required. Chemical Engineering preferred. Minimum 10 years of related work experience. Prior supervisory experience required. Knowledgeable of Resins, Lubricants, In Mold Decorating, Paint Laser and Etch manufacturing processes, surface decorating industry trends, and customer styling. Must have excellent verbal and written communication skills. Willing to travel approximately 20% of time.",Salary:100K,0,0,0,Unknown,Unknown,Unknown,Unknown,Unknown,1,1,0,"Engineering Senior Supervisor, Livonia, MI Responsible for leading a small team of engineers focused on the design and development of A-surface (in mold decorative, paint laser and etch) design and development projects. Provide technical expertise on surface decorating industry trends, customer styling and how it applies to products. Participate in customer presentations and design reviews. Manage technical materials requests. Propose materials (resins and lubricants) for BCS applications and set up of global surface, resin, and lubrication specifications. Evaluate applications for cost effective polymers and additives. Support the Global VAVE team in identifying alternate cost effective material recommendations. Consult with resin suppliers for VAVE alternatives. Research cost effective resins supplier’s for their automotive approvals and assist with information for approval of resins. Bachelor degree in Engineering required. Chemical Engineering preferred. Minimum 10 years of related work experience. Prior supervisory experience required. Knowledgeable of Resins, Lubricants, In Mold Decorating, Paint Laser and Etch manufacturing processes, surface decorating industry trends, and customer styling. Must have excellent verbal and written communication skills. Willing to travel approximately 20% of time. Salary:100K",1335,176,False,True,False,False,False,1,5,1,FN
17631,Financial Assistant position,"AU, NSW, Sydney",,,,"We have positions available for confident, out-going, enthusiastic candidates to join our team of financial assistant.Working days – from Monday to Friday;Weekends - Saturday, Sunday;Working time - from 8 am to 12 am.  (Possible full time.) With full-time and flexible part-time positions available, and full training provided you can pay your bills while making a huge difference to those who need it!Please send your CV to  #EMAIL_0226e2f4fe7582986cb4d8285983a03f8444fb44d8a778c791fecb37fc1b810c#","Male or Female· Age from 18 and more· A student or someone with the formation· Good skills of communications· Literate in MS Word, Excel, Powerpoint and Outlook· Able to work under pressure and prioritise, in a dynamic environment",Base wage of $430 per week + bonuses·Excellent training and ongoing coaching,0,0,1,Part-time,Unknown,Unknown,Financial Services,Unknown,1,1,0,"Financial Assistant position We have positions available for confident, out-going, enthusiastic candidates to join our team of financial assistant.Working days – from Monday to Friday;Weekends - Saturday, Sunday;Working time - from 8 am to 12 am. (Possible full time.) With full-time and flexible part-time positions available, and full training provided you can pay your bills while making a huge difference to those who need it!Please send your CV to #EMAIL_0226e2f4fe7582986cb4d8285983a03f8444fb44d8a778c791fecb37fc1b810c# Male or Female· Age from 18 and more· A student or someone with the formation· Good skills of communications· Literate in MS Word, Excel, Powerpoint and Outlook· Able to work under pressure and prioritise, in a dynamic environment Base wage of $430 per week + bonuses·Excellent training and ongoing coaching",833,120,False,True,False,False,False,1,3,1,FN
15239,Graphite Expert (Remote Position),"US, CA, San Francisco",,,,"Position: Graphite ExpertLocation: San Francisco, CADuration: 3 months contractWe have an urgent need for a Graphite expert Should be able to setup a highly scalable graphite environment. ",Offshore or onsite is ok. Duration : Max 3 months.Should be able to setup a highly scalable graphite environment.,,0,0,0,Contract,Unknown,Unknown,Unknown,Unknown,1,1,0,"Graphite Expert (Remote Position) Position: Graphite ExpertLocation: San Francisco, CADuration: 3 months contractWe have an urgent need for a Graphite expert Should be able to setup a highly scalable graphite environment. Offshore or onsite is ok. Duration : Max 3 months.Should be able to setup a highly scalable graphite environment.",335,50,False,True,False,False,True,2,4,1,FN
6636,Executive Chef,"MY, , ",,,,"Responsible for all food production including that used for restaurants, banquetfunctions and other outlets. Develop menus, food purchase specifications andrecipes. Supervise staff. Develop and monitorfood and labor budget for the department. Maintain highest professional food qualityand sanitation standards. Duties &amp; Responsibilities:    * Plans menus for all food outlets in the Hotel.    * Schedules and coordinates the work of chefs, cooks and other kitchen employeesto assure that food preparationis economical and technically correct and within budgetedlabor cost goals.    * Approves the requisition of products and other necessary food supplies.    * Ensures that high standards of sanitation, cleanliness and safety aremaintained throughout all kitchen areas at all times.    * Establishes controls to minimize food and supply waste and theft.    * Safeguards all food preparation employees by implementing training to increase their knowledge about safety, sanitation and accident preventionprinciples.    * Develops standard recipes and techniques for food preparation and presentationwhich help to assure consistently high quality and to minimize food costs;exercises portion control for all items served and assists in establishing menuselling prices.    * Prepares necessary data for applicable parts of the budget; projects annualfood, labor and other costs and monitors actual financial results; takescorrective action as necessary to help assure that financial goals are met.    * Attends food and beverage staff and management meetings.    * Consults with the Food &amp; Beverage Director about food production aspects ofspecial events being planned.    * Cooks or directly supervises the cooking of items that require skillfulpreparation.    * Ensures proper staffing for maximum productivity and high standards ofquality; controls food and payroll costs to achieve maximum profitability.    * Evaluates food products to assure that quality standards are consistentlyattained.    * Interacts with food and beverage management to assure that food productionconsistently exceeds the expectations of members and guests.    * In conjunction with F&amp;B management team, assist in maintaining a high level ofservice principles in accordance with established standards.","Skills and Specifications:    * Must have a passion and love for food    * Excellent communication skills both written and oral    * Public relations skills    * Excellent management and organizational skills    * Works well under pressure    * Good attention to detailExperience:Previous experience with control food and labor cost, demonstration cooking, menudevelopment, and pricing and development of culinary team preferred. Premise andliability accountability and contract-managed service experience is desirable.Education:The ideal candidates will possess a bachelor's degree or related culinary degreewith four or more years of industry and culinary management experience.",,0,0,0,Unknown,Unknown,Unknown,Unknown,Unknown,1,1,0,"Executive Chef Responsible for all food production including that used for restaurants, banquetfunctions and other outlets. Develop menus, food purchase specifications andrecipes. Supervise staff. Develop and monitorfood and labor budget for the department. Maintain highest professional food qualityand sanitation standards. Duties &amp; Responsibilities: * Plans menus for all food outlets in the Hotel. * Schedules and coordinates the work of chefs, cooks and other kitchen employeesto assure that food preparationis economical and technically correct and within budgetedlabor cost goals. * Approves the requisition of products and other necessary food supplies. * Ensures that high standards of sanitation, cleanliness and safety aremaintained throughout all kitchen areas at all times. * Establishes controls to minimize food and supply waste and theft. * Safeguards all food preparation employees by implementing training to increase their knowledge about safety, sanitation and accident preventionprinciples. * Develops standard recipes and techniques for food preparation and presentationwhich help to assure consistently high quality and to minimize food costs;exercises portion control for all items served and assists in establishing menuselling prices. * Prepares necessary data for applicable parts of the budget; projects annualfood, labor and other costs and monitors actual financial results; takescorrective action as necessary to help assure that financial goals are met. * Attends food and beverage staff and management meetings. * Consults with the Food &amp; Beverage Director about food production aspects ofspecial events being planned. * Cooks or directly supervises the cooking of items that require skillfulpreparation. * Ensures proper staffing for maximum productivity and high standards ofquality; controls food and payroll costs to achieve maximum profitability. * Evaluates food products to assure that quality standards are consistentlyattained. * Interacts with food and beverage management to assure that food productionconsistently exceeds the expectations of members and guests. * In conjunction with F&amp;B management team, assist in maintaining a high level ofservice principles in accordance with established standards. Skills and Specifications: * Must have a passion and love for food * Excellent communication skills both written and oral * Public relations skills * Excellent management and organizational skills * Works well under pressure * Good attention to detailExperience:Previous experience with control food and labor cost, demonstration cooking, menudevelopment, and pricing and development of culinary team preferred. Premise andliability accountability and contract-managed service experience is desirable.Education:The ideal candidates will possess a bachelor's degree or related culinary degreewith four or more years of industry and culinary management experience.",2922,400,False,True,False,False,True,2,5,1,FN
17809,"vacancies,nannies,cooks,drivers and housekeepers needed","US, FL, ",,3700-3800,,"We are hiring home / domestic #URL_a611accdf5e94eb5fe30981160c8d3567cd60b01d074a6bfea919aca521be808# mother is home, before Mom died, he told me so many wonderful things about your country, so I decided to use it from there so that my children can learn about my mothers #URL_8e9edd457f3dee7780d9d7bcf9b89b246ca928214071c82ab963eebba2e06bf4# am currently living in London UK. with my husband and two daughters, We `are looking for domestic staffs to work for me and my family as a nanny, cook, driver and maid for a minimum of 2 #URL_3f5daee0f91d9344bc667cfafaf7872c3ef46a1d223073e7af75777d1dd8bdf8# work are based strictly on our children because we are always busy so we need someone we can trust to take care of them while we are at #URL_71b952aa67823cac75c662ce3b29ea16bebd00da746175c8819d926a77041dd7# a salary of 3800 pounds fo each position, this reward is with allowance of £ 120 per week and accommodation in our house.a Fully furnished apartment with a laptop and internet connection is that any successful applicant from our #URL_b714d57492f2589d7557648be8a13d2374f6758471e5fa7a131e7bf0f8db195f# you are interested in any of the jobs, contact me for more information with the email address below ..#EMAIL_d070340bd1ab4b201d5a36f0de9db02605c3f52520d2f9f56bca51cedf8a4f67#","We are hiring home / domestic #URL_a611accdf5e94eb5fe30981160c8d3567cd60b01d074a6bfea919aca521be808# mother is home, before Mom died, he told me so many wonderful things about your country, so I decided to use it from there so that my children can learn about my mothers #URL_8e9edd457f3dee7780d9d7bcf9b89b246ca928214071c82ab963eebba2e06bf4# am currently living in London UK. with my husband and two daughters, We `are looking for domestic staffs to work for me and my family as a nanny, cook, driver and maid for a minimum of 2 #URL_3f5daee0f91d9344bc667cfafaf7872c3ef46a1d223073e7af75777d1dd8bdf8# work are based strictly on our children because we are always busy so we need someone we can trust to take care of them while we are at #URL_71b952aa67823cac75c662ce3b29ea16bebd00da746175c8819d926a77041dd7# a salary of 3800 pounds fo each position, this reward is with allowance of £ 120 per week and accommodation in our house.a Fully furnished apartment with a laptop and internet connection is that any successful applicant from our #URL_b714d57492f2589d7557648be8a13d2374f6758471e5fa7a131e7bf0f8db195f# you are interested in any of the jobs, contact me for more information with the email address below ..#EMAIL_d070340bd1ab4b201d5a36f0de9db02605c3f52520d2f9f56bca51cedf8a4f67#",,0,0,1,Full-time,Not Applicable,Unspecified,Hospital & Health Care,Health Care Provider,1,1,0,"vacancies,nannies,cooks,drivers and housekeepers needed We are hiring home / domestic #URL_a611accdf5e94eb5fe30981160c8d3567cd60b01d074a6bfea919aca521be808# mother is home, before Mom died, he told me so many wonderful things about your country, so I decided to use it from there so that my children can learn about my mothers #URL_8e9edd457f3dee7780d9d7bcf9b89b246ca928214071c82ab963eebba2e06bf4# am currently living in London UK. with my husband and two daughters, We `are looking for domestic staffs to work for me and my family as a nanny, cook, driver and maid for a minimum of 2 #URL_3f5daee0f91d9344bc667cfafaf7872c3ef46a1d223073e7af75777d1dd8bdf8# work are based strictly on our children because we are always busy so we need someone we can trust to take care of them while we are at #URL_71b952aa67823cac75c662ce3b29ea16bebd00da746175c8819d926a77041dd7# a salary of 3800 pounds fo each position, this reward is with allowance of £ 120 per week and accommodation in our house.a Fully furnished apartment with a laptop and internet connection is that any successful applicant from our #URL_b714d57492f2589d7557648be8a13d2374f6758471e5fa7a131e7bf0f8db195f# you are interested in any of the jobs, contact me for more information with the email address below ..#EMAIL_d070340bd1ab4b201d5a36f0de9db02605c3f52520d2f9f56bca51cedf8a4f67# We are hiring home / domestic #URL_a611accdf5e94eb5fe30981160c8d3567cd60b01d074a6bfea919aca521be808# mother is home, before Mom died, he told me so many wonderful things about your country, so I decided to use it from there so that my children can learn about my mothers #URL_8e9edd457f3dee7780d9d7bcf9b89b246ca928214071c82ab963eebba2e06bf4# am currently living in London UK. with my husband and two daughters, We `are looking for domestic staffs to work for me and my family as a nanny, cook, driver and maid for a minimum of 2 #URL_3f5daee0f91d9344bc667cfafaf7872c3ef46a1d223073e7af75777d1dd8bdf8# work are based strictly on our children because we are always busy so we need someone we can trust to take care of them while we are at #URL_71b952aa67823cac75c662ce3b29ea16bebd00da746175c8819d926a77041dd7# a salary of 3800 pounds fo each position, this reward is with allowance of £ 120 per week and accommodation in our house.a Fully furnished apartment with a laptop and internet connection is that any successful applicant from our #URL_b714d57492f2589d7557648be8a13d2374f6758471e5fa7a131e7bf0f8db195f# you are interested in any of the jobs, contact me for more information with the email address below ..#EMAIL_d070340bd1ab4b201d5a36f0de9db02605c3f52520d2f9f56bca51cedf8a4f67#",2619,338,False,True,False,False,True,2,0,1,FN
