job_id,title,location,department,salary_range,company_profile,description,requirements,benefits,telecommuting,has_company_logo,has_questions,employment_type,required_experience,required_education,industry,function,fraudulent,y_true,y_pred,combined_text,text_char_len,text_word_len,title_missing,company_profile_missing,description_missing,requirements_missing,benefits_missing,missing_text_fields,missing_cat_fields,is_error,error_type
8837,Maintenance Specialist,"US, TX, ARLINGTON",MAINT,23000-28000,"As the industry’s largest supply contracting company, Novation serves the purchasing needs of more than 65,000 VHA, UHC and Provista member organizations and their affilliates. Novation delivers unmatched supply savings and value through its sourcing services, as well as information and data services. Through its affiliation with VHA, UHC and Provista, Novation represents the largest purchasing volume in the industry more than $40 billion in annual purchases.To help our alliance members meet the needs of their communities, our mission is to deliver to them unmatched savings and value. One of the ways we deliver on our mission is by facilitating the introduction of products and services that are designed to help members drive sustainable results, improve quality and reduce costs.","ResponsibilitiesResponsibilities:Responsibilities:- Shipping and Receiving dock processing- Internal mail sorting and delivery- Special meeting set-up and tear down- Will be required to work in multiple facilities when needed- Plan and organize work for team of associates- Will perform other tasks as needed- Motivate associates to improve performance by developing and implementing innovative recognition ideas- Coach, train and develop associates- Manage service contracts and escalate concerns- Assist with writing and administering work reviews- Communicates progress of associates to supervisor and manager- Will perform other tasks as needed- Work with vendors on various initiatives and maintain an ongoing relationship when needed","Minimum Qualifications:- Effective computer skills (Word, Excel, and Outlook)- Proven ability to work with all levels of management- Effective communication skills (oral and written)- Ability to work independently- Experience with demonstrated leadership abilities and direct reports- Ability to balance multiple responsibilities simultaneously- Good team building skills- Basic analytical and mathematical skills- Strong decision making skills- Proven ability to manage and develop timelines","Compensation and BenefitsNOVATION  offers a competitive salary, a comprehensive selection of benefit options including 401(k).Conditions of EmploymentAll job offers are contingent upon succesful completion of credit and background checks.",0,1,1,Full-time,Entry level,High School or equivalent,Mechanical or Industrial Engineering,Engineering,1,1,0,"Maintenance Specialist As the industry’s largest supply contracting company, Novation serves the purchasing needs of more than 65,000 VHA, UHC and Provista member organizations and their affilliates. Novation delivers unmatched supply savings and value through its sourcing services, as well as information and data services. Through its affiliation with VHA, UHC and Provista, Novation represents the largest purchasing volume in the industry more than $40 billion in annual purchases.To help our alliance members meet the needs of their communities, our mission is to deliver to them unmatched savings and value. One of the ways we deliver on our mission is by facilitating the introduction of products and services that are designed to help members drive sustainable results, improve quality and reduce costs. ResponsibilitiesResponsibilities:Responsibilities:- Shipping and Receiving dock processing- Internal mail sorting and delivery- Special meeting set-up and tear down- Will be required to work in multiple facilities when needed- Plan and organize work for team of associates- Will perform other tasks as needed- Motivate associates to improve performance by developing and implementing innovative recognition ideas- Coach, train and develop associates- Manage service contracts and escalate concerns- Assist with writing and administering work reviews- Communicates progress of associates to supervisor and manager- Will perform other tasks as needed- Work with vendors on various initiatives and maintain an ongoing relationship when needed Minimum Qualifications:- Effective computer skills (Word, Excel, and Outlook)- Proven ability to work with all levels of management- Effective communication skills (oral and written)- Ability to work independently- Experience with demonstrated leadership abilities and direct reports- Ability to balance multiple responsibilities simultaneously- Good team building skills- Basic analytical and mathematical skills- Strong decision making skills- Proven ability to manage and develop timelines Compensation and BenefitsNOVATION offers a competitive salary, a comprehensive selection of benefit options including 401(k).Conditions of EmploymentAll job offers are contingent upon succesful completion of credit and background checks.",2283,311,False,False,False,False,False,0,0,1,FN
17819,Admin Assistant\Urgently,"AU, NSW, ",,,,"The company is seeking an Admin assistant to join their team! As traineeship. Relevant on job training will be provided.  Position is Part- Time Start ASAP  Duties include:  Meet and greet clients  Preparing files  Receive phone calls  Receiving emails and reply emails from reception ( instructions will be given) The successful candidate will be able to demonstrate:-Excellent communication skills, Technical Contractual and Negotiating skills.-Knowledge of application software including Word, Excel and Outlook from the microsoft Office suite (2007).-Strong team based work ethic.-Thrives on challenges and is accountable.This job will be suitable for school leavers who are looking their career. If you are interested in applying for the position, please send resume with your full name and email to #EMAIL_bf7aada68f2ebd311c3cb873b1867e0c531121ccdc5392441c6cea7a5d852d06#",,,0,0,0,Unknown,Unknown,Unknown,Unknown,Unknown,1,1,0,"Admin Assistant\Urgently The company is seeking an Admin assistant to join their team! As traineeship. Relevant on job training will be provided. Position is Part- Time Start ASAP Duties include: Meet and greet clients Preparing files Receive phone calls Receiving emails and reply emails from reception ( instructions will be given) The successful candidate will be able to demonstrate:-Excellent communication skills, Technical Contractual and Negotiating skills.-Knowledge of application software including Word, Excel and Outlook from the microsoft Office suite (2007).-Strong team based work ethic.-Thrives on challenges and is accountable.This job will be suitable for school leavers who are looking their career. If you are interested in applying for the position, please send resume with your full name and email to #EMAIL_bf7aada68f2ebd311c3cb873b1867e0c531121ccdc5392441c6cea7a5d852d06#",896,121,False,True,False,True,True,3,5,1,FN
8250,Senior System Test Engineer,"US, CA, San Jose",Engineering ,,"NETGEAR and Aptitude Staffing Solutions have partnered up in an effort to streamline the hiring process and provide a more efficient and effective recruitng model.  Our focus is to help develop and achieve your career goals while makeing a solid geographical, cultural and professional fiit when leveraging your career into your new and exciting professional venture!  NETGEAR, Inc. (NASDAQGM: NTGR) designs innovative, branded technology solutions that address the specific networking, storage, and security needs of small- to medium-sized businesses and home users. The company offers an end-to-end networking product portfolio to enable users to share Internet access, peripherals, files, multimedia content, and applications among multiple computers and other Internet-enabled devices. Products are built on a variety of proven technologies such as wireless, Ethernet and powerline, with a focus on reliability and ease-of-use. NETGEAR products are sold in over 27,000 retail locations around the globe, and via more than 37,000 value-added resellers. The company's headquarters are in San Jose, Calif., with additional offices in 25 countries. Recruiting: #EMAIL_f4da338e899ddba983ac771b001681d1d2d93b3327ddc420a15f4e5a310071a9#  Media Inquiries: #EMAIL_1009f70bbfd3e2b05e1e73a998e14884ac7a09fe35b338b1f7f8767cf03effce# Investor Relations: #EMAIL_7ae15a228205094fb8cf58fbcb428394154f1c25f9629da4d54e091b86ce1037#","Senior System Test Engineer | San Jose, CAAs a member of the Service Provider Engineering team, you will be responsible for the design quality of DSL products with specific emphasis on IADs (VoIP).    Our DSL and Cable broadband products address Home Gateway, IPTV and Voice over IP (VoIP) services and are targeted at service providers.  These products will incorporate one or several of the following technologies:  DSL, PPPoX, DNS/DHCP, IP, SIP, IGMP, 802.11 Wireless, Ethernet, VPN, Firewalls, 3G / LTE.Job ResponsibilitiesMonitor and oversee the ODM quality processes and QA test, and verify test coverage.Work within the engineering development organization to verify the design quality of DSL products.Perform product testing to verify product performance and diagnose product defects.Perform verification and regression testing for bug fixes.  Log, track and drive to closure all bugs directly with overseas developers.Develop test plans from requirements and supervise QA testing both within our company and in overseas supplier’s labs.Set up and maintain in-house DSL, 3G / LTE, VoIP and IPTV Network test bedMonitor/Manage qualification of products with customers and understand customer requirements and test plans.Create additional test cases as required to cover customer’s requirements.Send regular Test Status Reports to product team with metrics to indicate overall test progress and product maturity.Provide input for manuals, help files, application notes and tech support web pagesSupport any 3rd level technical escalations from our technical support.Evaluate new products and reference designs.","Skills and RequirementsBS in Computer Science or Engineering. 5 years in QA or System Test in a lead role testing networking productsWell-versed in QA methodologies and Test Driven Development.Experience using test tools, such as Test Director, WinRunner, QAPartner, etc.Hands-on test capability, operate wired and mobile network test equipment, build test environments, troubleshoot networks and productsIn depth knowledge of VoIP (SIP, MGCP), for example can setup and configure Softswitch, perform voice quality testing etcStrong understanding of IP networking, TCP/IP, HTTP, FTP, DNS and other IP communication protocols. Knowledge of routers, Wireless (802.11x), VPN.Knowledge of DSL standards and industry is a plus.Hands-on experience with Rohde &amp; Schwarz CMU200 / CMW500 a plus.Ability to independently track and resolve issues.Teamwork.  This position requires a close working relationship with the extended team, including engineering, operations, sales, customer support, marketing and program managementMulti-tasker.  Experience working in a start-up environment.Good communication skills, both written and verbal.Fluency in Mandarin is a plus.","Broad responsibility, autonomy and visibility in an Engineering role.In-depth exposure to real-world customer issues across a global customer baseSmall-company feel in a growth environmentOpportunity for executive advancementVery competitive compensation packageBonus ProgramFull benefits packageAttractive retirement programReputable world-class leadershipSignificant stake in equity, stock optionsQualified candidates are encouraged to apply directly to this job posting.  Direct email and phone calls are not being considered.  Thank you for your cooperation.  Please no recruiters.  ",0,1,1,Full-time,Mid-Senior level,Bachelor's Degree,Computer Networking,Engineering,1,1,0,"Senior System Test Engineer NETGEAR and Aptitude Staffing Solutions have partnered up in an effort to streamline the hiring process and provide a more efficient and effective recruitng model. Our focus is to help develop and achieve your career goals while makeing a solid geographical, cultural and professional fiit when leveraging your career into your new and exciting professional venture! NETGEAR, Inc. (NASDAQGM: NTGR) designs innovative, branded technology solutions that address the specific networking, storage, and security needs of small- to medium-sized businesses and home users. The company offers an end-to-end networking product portfolio to enable users to share Internet access, peripherals, files, multimedia content, and applications among multiple computers and other Internet-enabled devices. Products are built on a variety of proven technologies such as wireless, Ethernet and powerline, with a focus on reliability and ease-of-use. NETGEAR products are sold in over 27,000 retail locations around the globe, and via more than 37,000 value-added resellers. The company's headquarters are in San Jose, Calif., with additional offices in 25 countries. Recruiting: #EMAIL_f4da338e899ddba983ac771b001681d1d2d93b3327ddc420a15f4e5a310071a9# Media Inquiries: #EMAIL_1009f70bbfd3e2b05e1e73a998e14884ac7a09fe35b338b1f7f8767cf03effce# Investor Relations: #EMAIL_7ae15a228205094fb8cf58fbcb428394154f1c25f9629da4d54e091b86ce1037# Senior System Test Engineer | San Jose, CAAs a member of the Service Provider Engineering team, you will be responsible for the design quality of DSL products with specific emphasis on IADs (VoIP). Our DSL and Cable broadband products address Home Gateway, IPTV and Voice over IP (VoIP) services and are targeted at service providers. These products will incorporate one or several of the following technologies: DSL, PPPoX, DNS/DHCP, IP, SIP, IGMP, 802.11 Wireless, Ethernet, VPN, Firewalls, 3G / LTE.Job ResponsibilitiesMonitor and oversee the ODM quality processes and QA test, and verify test coverage.Work within the engineering development organization to verify the design quality of DSL products.Perform product testing to verify product performance and diagnose product defects.Perform verification and regression testing for bug fixes. Log, track and drive to closure all bugs directly with overseas developers.Develop test plans from requirements and supervise QA testing both within our company and in overseas supplier’s labs.Set up and maintain in-house DSL, 3G / LTE, VoIP and IPTV Network test bedMonitor/Manage qualification of products with customers and understand customer requirements and test plans.Create additional test cases as required to cover customer’s requirements.Send regular Test Status Reports to product team with metrics to indicate overall test progress and product maturity.Provide input for manuals, help files, application notes and tech support web pagesSupport any 3rd level technical escalations from our technical support.Evaluate new products and reference designs. Skills and RequirementsBS in Computer Science or Engineering. 5 years in QA or System Test in a lead role testing networking productsWell-versed in QA methodologies and Test Driven Development.Experience using test tools, such as Test Director, WinRunner, QAPartner, etc.Hands-on test capability, operate wired and mobile network test equipment, build test environments, troubleshoot networks and productsIn depth knowledge of VoIP (SIP, MGCP), for example can setup and configure Softswitch, perform voice quality testing etcStrong understanding of IP networking, TCP/IP, HTTP, FTP, DNS and other IP communication protocols. Knowledge of routers, Wireless (802.11x), VPN.Knowledge of DSL standards and industry is a plus.Hands-on experience with Rohde &amp; Schwarz CMU200 / CMW500 a plus.Ability to independently track and resolve issues.Teamwork. This position requires a close working relationship with the extended team, including engineering, operations, sales, customer support, marketing and program managementMulti-tasker. Experience working in a start-up environment.Good communication skills, both written and verbal.Fluency in Mandarin is a plus. Broad responsibility, autonomy and visibility in an Engineering role.In-depth exposure to real-world customer issues across a global customer baseSmall-company feel in a growth environmentOpportunity for executive advancementVery competitive compensation packageBonus ProgramFull benefits packageAttractive retirement programReputable world-class leadershipSignificant stake in equity, stock optionsQualified candidates are encouraged to apply directly to this job posting. Direct email and phone calls are not being considered. Thank you for your cooperation. Please no recruiters.",4795,631,False,False,False,False,False,0,0,1,FN
17770,Data Entry Clerk,"US, DC, ",,48000-55000,"DRS Technologies is a leading supplier of integrated products, services and support to military forces, intelligence agencies and prime contractors worldwide. Focused on defense technology, the Company develops, manufactures and supports a broad range of systems for mission critical and military sustainment requirements, as well as homeland security. The Company has been recognized as one of the fastest growing defense technology companies in the world and holds leading market positions in thermal imaging devices, combat display workstations, electronic sensor systems, power systems, rugged computer systems, air combat training systems, mission recorders, deployable flight incident recorders, environmental control systems, telecommunication systems, aircraft loaders, military trailers and shelters, and integrated logistics and support services. DRS strives to provide quality products and services and stand behind them, to invest in research and development and new market opportunities, and to leverage existing core defense programs and business areas.","DRS Technologies is committed to recruiting and retaining the best talent in the defense and aerospace industry and niche commercial technology areas. We offer an exciting and challenging work environment, a competitive salary and benefits package, and a business culture that rewards performance. DRS Technologies is seeking for administrative and executive assistants to receptionists, data entry clerks, and customer service representatives.In the Data Entry Clerk role, you must be able to multitask and pay exceptional attention to details. We are seeking a dedicated individual with excellent customer service and communication skills. You must be able to work independently, learn quickly, and exercise sound judgment. RESPONSIBILITIESPerforms a wide variety of activities, which may include one or more of the following:-Processing invoices and data entry-Matches and distributes A/P checks-General Ledger Entries -Bank reconciliation -Handling Transactions-Maintain reports in Excel-Inputting information from a variety of sources-Clerical duties-Data entry skills + 10 key helpful","Minimum of High School DiplomaSelf-starterResponsible &amp; dependable with good prioritization skillsProficient in Microsoft Word, Excel and OutlookProficient with QuickBooks and/or other Accounting softwareUnderstanding of customer service protocolsStrong phone presenceGeneral Math SkillsThoroughness and attention to detail","Benefits include:Medical, Rx, and Wellness Benefits.Dental and Vision Plan Options.Short-term Disability.401(k) Retirement Plan.Holiday Pay.",0,1,0,Full-time,Entry level,High School or equivalent,Unknown,Data Analyst,1,1,0,"Data Entry Clerk DRS Technologies is a leading supplier of integrated products, services and support to military forces, intelligence agencies and prime contractors worldwide. Focused on defense technology, the Company develops, manufactures and supports a broad range of systems for mission critical and military sustainment requirements, as well as homeland security. The Company has been recognized as one of the fastest growing defense technology companies in the world and holds leading market positions in thermal imaging devices, combat display workstations, electronic sensor systems, power systems, rugged computer systems, air combat training systems, mission recorders, deployable flight incident recorders, environmental control systems, telecommunication systems, aircraft loaders, military trailers and shelters, and integrated logistics and support services. DRS strives to provide quality products and services and stand behind them, to invest in research and development and new market opportunities, and to leverage existing core defense programs and business areas. DRS Technologies is committed to recruiting and retaining the best talent in the defense and aerospace industry and niche commercial technology areas. We offer an exciting and challenging work environment, a competitive salary and benefits package, and a business culture that rewards performance. DRS Technologies is seeking for administrative and executive assistants to receptionists, data entry clerks, and customer service representatives.In the Data Entry Clerk role, you must be able to multitask and pay exceptional attention to details. We are seeking a dedicated individual with excellent customer service and communication skills. You must be able to work independently, learn quickly, and exercise sound judgment. RESPONSIBILITIESPerforms a wide variety of activities, which may include one or more of the following:-Processing invoices and data entry-Matches and distributes A/P checks-General Ledger Entries -Bank reconciliation -Handling Transactions-Maintain reports in Excel-Inputting information from a variety of sources-Clerical duties-Data entry skills + 10 key helpful Minimum of High School DiplomaSelf-starterResponsible &amp; dependable with good prioritization skillsProficient in Microsoft Word, Excel and OutlookProficient with QuickBooks and/or other Accounting softwareUnderstanding of customer service protocolsStrong phone presenceGeneral Math SkillsThoroughness and attention to detail Benefits include:Medical, Rx, and Wellness Benefits.Dental and Vision Plan Options.Short-term Disability.401(k) Retirement Plan.Holiday Pay.",2644,345,False,False,False,False,False,0,1,1,FN
