job_id,title,location,department,salary_range,company_profile,description,requirements,benefits,telecommuting,has_company_logo,has_questions,employment_type,required_experience,required_education,industry,function,fraudulent,y_true,y_pred,combined_text,text_char_len,text_word_len,title_missing,company_profile_missing,description_missing,requirements_missing,benefits_missing,missing_text_fields,missing_cat_fields,is_error,error_type
6231,Travel Agent,"US, FL, Tampa",,,,"Advantage xPO is part of the Advantage Resourcing group, which is among the ten largest global staffing firms. Advantage specializes in providing contingent and permanent workforce solutions. Every day, we talk to hiring managers, HR directors and senior management to learn their needs. At the same time, we talk about skills and goals with talented people seeking employment opportunities. This ongoing, face-to-face communication gives us a staffing perspective that’s simply unmatched. We are in tune with local conditions, and yet our reach is undeniably global. We don’t hesitate to look across the country or even the globe to align qualified talent with appropriate positions.Our Client, American Express, is in need of a Business Travel Counselor (contractor). He/She will be responsible for coordinating the company's travel needs and scheduling hotel and flight accommodations and procures necessary documentation such as passports, visas, or other clearances. The Business Travel Counselor will also ensure that travel needs are met within the constraints of the company travel budget. This is a 12 month contract opportunity with the possibility of becoming permanent.  ","Must have travel experience (hotel, Car, airline)Must have SABRE or Apollo experienceRequires a high school diploma or GED with 2 years of experience in the field or in a related area.",,0,0,1,Full-time,Unknown,High School or equivalent,Unknown,Unknown,1,1,0,"Travel Agent Advantage xPO is part of the Advantage Resourcing group, which is among the ten largest global staffing firms. Advantage specializes in providing contingent and permanent workforce solutions. Every day, we talk to hiring managers, HR directors and senior management to learn their needs. At the same time, we talk about skills and goals with talented people seeking employment opportunities. This ongoing, face-to-face communication gives us a staffing perspective that’s simply unmatched. We are in tune with local conditions, and yet our reach is undeniably global. We don’t hesitate to look across the country or even the globe to align qualified talent with appropriate positions.Our Client, American Express, is in need of a Business Travel Counselor (contractor). He/She will be responsible for coordinating the company's travel needs and scheduling hotel and flight accommodations and procures necessary documentation such as passports, visas, or other clearances. The Business Travel Counselor will also ensure that travel needs are met within the constraints of the company travel budget. This is a 12 month contract opportunity with the possibility of becoming permanent. Must have travel experience (hotel, Car, airline)Must have SABRE or Apollo experienceRequires a high school diploma or GED with 2 years of experience in the field or in a related area.",1379,209,False,True,False,False,True,2,3,1,FN
11588,SEO Analysis,"US, CA, San Mateo",Information Technology,,"Bright Edge and Aptitude Staffing Solutions have partnered up in an effort to streamline the hiring process and provide a more efficient and effective recruitng model.  Our focus is to help develop and achieve your career goals while makeing a solid geographical, cultural and professional fiit when leveraging your career into your new and exciting professional venture!BrightEdge today is over 180 employees strong, and continuously growing. BrightEdge has over 8400 brands and 650 direct customers, and has lead the market in SEO innovation. The new headquarters reflect BrightEdge's growth and the maturity of the company, with a sleek and modern space in the heart of Silicon Valley.Stay tuned, as BrightEdge's story is only beginning. ",Seeking an SEO Analyst to drive traffic from organic search.  The ideal candidate will be extremely detail oriented with SEO or online Marketing Campaign Management experience.  This is great ground floor opportunity to join a Nascent Digital Marketing team to establish new processes.  You will work with accomplished B2C and B2B digital marketers to bring your expertise to this best-in-class team. Responsibilities: Owning and growing our organic content marketing.Internal usage of company platform.Analysis of organic rankings volatility.Backlink management.Landing page optimization for search engine rankings.Tracking social metrics. ,"Qualifications: 2+ years of experience with proven SEO results.Solid understanding of SEO and HTML.Strong forensics, problem solving, and analytical skills.Ability to work cross-functionally with product, marketing, and design teams.Proficiency in site analytics, Google Analytics preferred.Self-starter/self-motivated, capable of staying on track and pursuing solutions without supervision.Ability to work under pressure, meet deadlines and handle multiple projects simultaneously. Preferred Qualifications: Experience in a B2B SaaS company.Experience with Drupal, Wordpress and Marketo.Engineering background. ",,0,1,1,Full-time,Mid-Senior level,Bachelor's Degree,Marketing and Advertising,Information Technology,1,1,0,"SEO Analysis Bright Edge and Aptitude Staffing Solutions have partnered up in an effort to streamline the hiring process and provide a more efficient and effective recruitng model. Our focus is to help develop and achieve your career goals while makeing a solid geographical, cultural and professional fiit when leveraging your career into your new and exciting professional venture!BrightEdge today is over 180 employees strong, and continuously growing. BrightEdge has over 8400 brands and 650 direct customers, and has lead the market in SEO innovation. The new headquarters reflect BrightEdge's growth and the maturity of the company, with a sleek and modern space in the heart of Silicon Valley.Stay tuned, as BrightEdge's story is only beginning. Seeking an SEO Analyst to drive traffic from organic search. The ideal candidate will be extremely detail oriented with SEO or online Marketing Campaign Management experience. This is great ground floor opportunity to join a Nascent Digital Marketing team to establish new processes. You will work with accomplished B2C and B2B digital marketers to bring your expertise to this best-in-class team. Responsibilities: Owning and growing our organic content marketing.Internal usage of company platform.Analysis of organic rankings volatility.Backlink management.Landing page optimization for search engine rankings.Tracking social metrics. Qualifications: 2+ years of experience with proven SEO results.Solid understanding of SEO and HTML.Strong forensics, problem solving, and analytical skills.Ability to work cross-functionally with product, marketing, and design teams.Proficiency in site analytics, Google Analytics preferred.Self-starter/self-motivated, capable of staying on track and pursuing solutions without supervision.Ability to work under pressure, meet deadlines and handle multiple projects simultaneously. Preferred Qualifications: Experience in a B2B SaaS company.Experience with Drupal, Wordpress and Marketo.Engineering background.",2002,272,False,False,False,False,True,1,0,1,FN
8310,Software Architect ,"US, , San Jose",Engineering ,,"NETGEAR and Aptitude Staffing Solutions have partnered up in an effort to streamline the hiring process and provide a more efficient and effective recruitng model.  Our focus is to help develop and achieve your career goals while makeing a solid geographical, cultural and professional fiit when leveraging your career into your new and exciting professional venture!  NETGEAR, Inc. (NASDAQGM: NTGR) designs innovative, branded technology solutions that address the specific networking, storage, and security needs of small- to medium-sized businesses and home users. The company offers an end-to-end networking product portfolio to enable users to share Internet access, peripherals, files, multimedia content, and applications among multiple computers and other Internet-enabled devices. Products are built on a variety of proven technologies such as wireless, Ethernet and powerline, with a focus on reliability and ease-of-use. NETGEAR products are sold in over 27,000 retail locations around the globe, and via more than 37,000 value-added resellers. The company's headquarters are in San Jose, Calif., with additional offices in 25 countries. Recruiting: #EMAIL_f4da338e899ddba983ac771b001681d1d2d93b3327ddc420a15f4e5a310071a9#  Media Inquiries: #EMAIL_1009f70bbfd3e2b05e1e73a998e14884ac7a09fe35b338b1f7f8767cf03effce# Investor Relations: #EMAIL_7ae15a228205094fb8cf58fbcb428394154f1c25f9629da4d54e091b86ce1037#","Software ArchitectSan Jose, CA The Short &amp; Sweet:The software architect is responsible for the all of the software architecture activities for theSPBU (Service Provider Business Unit). S/he will maintain overall responsibility to devise, develop and implement SPBU messaging on the Internet including Company corporate website and its affiliates. He is also responsible to track and if necessary, represent SPBU at the appropriate standards bodies that influence SPBU product strategy. The SLA works closely with Product Line Managers (PLMs), R&amp;D, Marketing Communications, and worldwide Sales and Company’s technology and ODM partners to ensure all key aspects of the technical product strategy are addressed and implemented for success of the product line. Essentials: Develop, devise and implement an overall software Strategy for SPBU.Will be the owner of the operating system platform roadmap and its delivery to all the platforms supported.Will attend relevant forums to define specifications for new features and technologies.Defines goals and strategy to achieve thought leadership in the market place for Company, achieves cross-functional support and executes.Defines, constantly reviews, and differentiates the feature sets of the entire product line and individual products active in the product life cycle.Provide input for developing compelling and comprehensive product collateral to support SPBU Marketing and Sales teams for pre-sales and post-sales activities. Collateral includes Datasheets, Product Briefs/Slicks, White Papers, Case Studies, Product Presentations, and when needed, Videos.Activities encompass contributing articles in technical and trade publications, industry analyst briefings, Press Releases, and trade show speaking engagements.Takes the role as internal expert as well as external spokesperson and evangelist for SPBU Products.Working closely with the software team, help develop a strong patent portfolio.Provide technical leadership in responding to RFIs and RFPs.Take high level feature requirements from marketing teams and customers and write detailed feature specifications for the software team.Work closely with partners to define architecture and requirements for tasking new products and features to market.  ","Desired Skills &amp; Experience:Strong technical background, with prior experience working with Service Providers in the Telco, Cable and/or Mobile space.Ability to take a new technical standard, understand and translate into relevant requirements for the products is a must.Must have the ability to work independently to devise overall software strategy and drive the implementation while working with cross-functional teams.Ability to communicate &amp; gain support for project vision.Strong understanding of networking and consumer electronics, technology and products related to product line.Good interpersonal skills and able to work well with people from all regions at all technical and management levels.Mature communication with partners, peers and managers. Skillful verbal and writing abilities and effective presentation skills.Five to seven years of software architecture in telecom and networking experience with demonstrated knowledge of technology, industry and branding.Thorough understanding of the service provider market is a must.Demonstrated leadership skills to focus internal resources, coordinate R&amp;D and coordinate business partners.Past background in software development is a must to understand and work closely with software engineers.B.S./ In Computer Science or Electrical Engineering","What Is Offered:Very competitive base salary.30% bonus structure, guaranteed annually.Significant stake in equity/stock optionsFull benefits package along with many perksOpportunity for Executive-level advancement and career leverageWorld renowned leadership, mentorship, and a very attractive culture/work environmentRelocation assistence if neededSigning bonus through placement agency Unique and attractive company culture and environment Highly visable products, leading technologies and recognition Global environment, global product stage in a fast-paced, start-up environmentQualified candidates are encouraged to apply directly to this job posting.  Direct email and phone calls are not being considered.  Thank you for your cooperation.  Please no recruiters.  ",0,1,1,Full-time,Mid-Senior level,Bachelor's Degree,Telecommunications,Engineering,1,1,0,"Software Architect NETGEAR and Aptitude Staffing Solutions have partnered up in an effort to streamline the hiring process and provide a more efficient and effective recruitng model. Our focus is to help develop and achieve your career goals while makeing a solid geographical, cultural and professional fiit when leveraging your career into your new and exciting professional venture! NETGEAR, Inc. (NASDAQGM: NTGR) designs innovative, branded technology solutions that address the specific networking, storage, and security needs of small- to medium-sized businesses and home users. The company offers an end-to-end networking product portfolio to enable users to share Internet access, peripherals, files, multimedia content, and applications among multiple computers and other Internet-enabled devices. Products are built on a variety of proven technologies such as wireless, Ethernet and powerline, with a focus on reliability and ease-of-use. NETGEAR products are sold in over 27,000 retail locations around the globe, and via more than 37,000 value-added resellers. The company's headquarters are in San Jose, Calif., with additional offices in 25 countries. Recruiting: #EMAIL_f4da338e899ddba983ac771b001681d1d2d93b3327ddc420a15f4e5a310071a9# Media Inquiries: #EMAIL_1009f70bbfd3e2b05e1e73a998e14884ac7a09fe35b338b1f7f8767cf03effce# Investor Relations: #EMAIL_7ae15a228205094fb8cf58fbcb428394154f1c25f9629da4d54e091b86ce1037# Software ArchitectSan Jose, CA The Short &amp; Sweet:The software architect is responsible for the all of the software architecture activities for theSPBU (Service Provider Business Unit). S/he will maintain overall responsibility to devise, develop and implement SPBU messaging on the Internet including Company corporate website and its affiliates. He is also responsible to track and if necessary, represent SPBU at the appropriate standards bodies that influence SPBU product strategy. The SLA works closely with Product Line Managers (PLMs), R&amp;D, Marketing Communications, and worldwide Sales and Company’s technology and ODM partners to ensure all key aspects of the technical product strategy are addressed and implemented for success of the product line. Essentials: Develop, devise and implement an overall software Strategy for SPBU.Will be the owner of the operating system platform roadmap and its delivery to all the platforms supported.Will attend relevant forums to define specifications for new features and technologies.Defines goals and strategy to achieve thought leadership in the market place for Company, achieves cross-functional support and executes.Defines, constantly reviews, and differentiates the feature sets of the entire product line and individual products active in the product life cycle.Provide input for developing compelling and comprehensive product collateral to support SPBU Marketing and Sales teams for pre-sales and post-sales activities. Collateral includes Datasheets, Product Briefs/Slicks, White Papers, Case Studies, Product Presentations, and when needed, Videos.Activities encompass contributing articles in technical and trade publications, industry analyst briefings, Press Releases, and trade show speaking engagements.Takes the role as internal expert as well as external spokesperson and evangelist for SPBU Products.Working closely with the software team, help develop a strong patent portfolio.Provide technical leadership in responding to RFIs and RFPs.Take high level feature requirements from marketing teams and customers and write detailed feature specifications for the software team.Work closely with partners to define architecture and requirements for tasking new products and features to market. Desired Skills &amp; Experience:Strong technical background, with prior experience working with Service Providers in the Telco, Cable and/or Mobile space.Ability to take a new technical standard, understand and translate into relevant requirements for the products is a must.Must have the ability to work independently to devise overall software strategy and drive the implementation while working with cross-functional teams.Ability to communicate &amp; gain support for project vision.Strong understanding of networking and consumer electronics, technology and products related to product line.Good interpersonal skills and able to work well with people from all regions at all technical and management levels.Mature communication with partners, peers and managers. Skillful verbal and writing abilities and effective presentation skills.Five to seven years of software architecture in telecom and networking experience with demonstrated knowledge of technology, industry and branding.Thorough understanding of the service provider market is a must.Demonstrated leadership skills to focus internal resources, coordinate R&amp;D and coordinate business partners.Past background in software development is a must to understand and work closely with software engineers.B.S./ In Computer Science or Electrical Engineering What Is Offered:Very competitive base salary.30% bonus structure, guaranteed annually.Significant stake in equity/stock optionsFull benefits package along with many perksOpportunity for Executive-level advancement and career leverageWorld renowned leadership, mentorship, and a very attractive culture/work environmentRelocation assistence if neededSigning bonus through placement agency Unique and attractive company culture and environment Highly visable products, leading technologies and recognition Global environment, global product stage in a fast-paced, start-up environmentQualified candidates are encouraged to apply directly to this job posting. Direct email and phone calls are not being considered. Thank you for your cooperation. Please no recruiters.",5787,750,False,False,False,False,False,0,0,1,FN
16861,Process Validation Project Manager ,"US, NC, RTP ",Engineering,60000-100000,"Maynard Consulting Company has more than 20 years experience in the biotechnology, pharmaceutical, medical device, chemical, and validation engineering fields. In addition, we have over 10 years in project management, software engineering, telecommunication, testing, and networking engineering.  MCC partners with skilled candidates to meet and exceed their career expectations.","Responsibility for the project management of assembly and packaging processes for manufacturing Sample Collection products/devices.Responsibility for supporting new product introductions with the concepting, prototyping and commercialization of new equipment technology.Works closely with Design, R&amp;D Marketing and manufacturing plants to implement manufacturing technology.Under the Engineering Manager Assembly, Contractor will be responsible for the project management of the concepting, prototyping, design, build and commercialization of new process equipment.Develops and executes the technical and business strategy to accomplish project goals.Provides the process technology leadership for assembly on the multifunctional project teams focused on new product implementation.Supports manufacturing plants in cost reduction, standardization and equipment upgrade projects.Develops capital and product cost analysis; writes and submits capital appropriations;","10+ years’ experience in high-speed automated equipment development or high volume manufacturing industry; healthcare, food products or pharmaceutical industry experience preferred.Experience in organizing and leading multi-function teams .Demonstrated capability in project management, with experience on large capital projects related to high-speed automated equipment development .Experience working in a development environment, with an understanding of process design, process capability and manufacturing cost analysis .Working knowledge of Good Manufacturing Practices and Six Sigma.#URL_7e94b9dc45c2319c1dffe1d1646563b8cf079c66d210b9bb860f4f51783ffb03#",,0,1,1,Contract,Mid-Senior level,Bachelor's Degree,Biotechnology,Engineering,1,1,0,"Process Validation Project Manager Maynard Consulting Company has more than 20 years experience in the biotechnology, pharmaceutical, medical device, chemical, and validation engineering fields. In addition, we have over 10 years in project management, software engineering, telecommunication, testing, and networking engineering. MCC partners with skilled candidates to meet and exceed their career expectations. Responsibility for the project management of assembly and packaging processes for manufacturing Sample Collection products/devices.Responsibility for supporting new product introductions with the concepting, prototyping and commercialization of new equipment technology.Works closely with Design, R&amp;D Marketing and manufacturing plants to implement manufacturing technology.Under the Engineering Manager Assembly, Contractor will be responsible for the project management of the concepting, prototyping, design, build and commercialization of new process equipment.Develops and executes the technical and business strategy to accomplish project goals.Provides the process technology leadership for assembly on the multifunctional project teams focused on new product implementation.Supports manufacturing plants in cost reduction, standardization and equipment upgrade projects.Develops capital and product cost analysis; writes and submits capital appropriations; 10+ years’ experience in high-speed automated equipment development or high volume manufacturing industry; healthcare, food products or pharmaceutical industry experience preferred.Experience in organizing and leading multi-function teams .Demonstrated capability in project management, with experience on large capital projects related to high-speed automated equipment development .Experience working in a development environment, with an understanding of process design, process capability and manufacturing cost analysis .Working knowledge of Good Manufacturing Practices and Six Sigma.#URL_7e94b9dc45c2319c1dffe1d1646563b8cf079c66d210b9bb860f4f51783ffb03#",2043,237,False,False,False,False,True,1,0,1,FN
